{
  "schema": "auto-g16-metal-p0-p5-readiness/1",
  "matrix_id": "metal_p0_p5_integration_20260716",
  "status_date": "2026-07-16",
  "claim_ceiling": "p0_p5_engineering_and_evidence_status_index_only_no_scientific_acceptance_execution_live_authority_or_chemical_path_coverage",
  "live_actions": {"authorized": false, "executed": false},
  "dimensions": {
    "implemented": "the repository contains and offline-tests the engineering contract for this phase",
    "evidence_complete": "all candidate-bound scientific evidence and reviews required by this phase are complete",
    "executable": "the phase has every scientific and authorization gate needed to permit its next action"
  },
  "milestones": [
    {
      "phase": "P0",
      "status": "r33_rejected_replacement_selection_blocked",
      "implemented": true,
      "evidence_complete": false,
      "executable": false,
      "evidence": [
        {"kind": "commit", "locator": "5218c831ecd849e57446d1601c8e4df33e3e0640", "sha256": null},
        {"kind": "artifact", "locator": "studies/metal_m4_p0_p1_baseline/baseline.json", "sha256": "73317d7fdaf63edb26866452371cf7b637c998fa60fd2d1fe75d7ac1ab7a9003"},
        {"kind": "contract", "locator": "contracts/metal-ts/first-metal-smoke-decision.schema.json", "sha256": "ef73fb4964946ebd82d97aabd77118952da100b7b2824329b086fdaa4fe737db"},
        {"kind": "artifact", "locator": "studies/metal_m4_p0_p1_baseline/r33-first-metal-smoke-decision.json", "sha256": "3188f84c27264003654ce265a9ab06fd759b76ea569df364a5ce87dc527d17ff"},
        {"kind": "contract", "locator": "contracts/metal-ts/replacement-candidate-selection.schema.json", "sha256": "9be4a6c53ebf89b9148d02748afbf9a46e2efa5c8057f1632970143275240a7a"},
        {"kind": "artifact", "locator": "studies/metal_m4_p0_p1_baseline/replacement-candidate-selection.json", "sha256": "0e374aef37e58aed942ae5805d9a4a00588af020b66ee0ecbd5f6731982fd83b"},
        {"kind": "contract", "locator": "contracts/metal-ts/pd-phox-ts20-closure.schema.json", "sha256": "b42261e64c9814be14ccca2120b5c5a0a983c3bd251ea20ba5298c547e757a5c"},
        {"kind": "artifact", "locator": "studies/metal_m4_p0_p1_baseline/pd-phox-ts20-candidate-closure.json", "sha256": "11869e495ed7af7ef416333d2c7b48ed463d822d11a688e6a2b58f93c00d10d1"}
      ],
      "blockers": ["R33 is formally rejected as the first metal smoke because its candidate-bound identity and electronic-structure model cannot be closed.", "The Pd(PHOX) TS20 follow-up corrected the source DOI and closed precursor/TS coordinate hashes and atom order, but charge, multiplicity, electron accounting, wavefunction policy, reaction-coordinate atoms, candidate mode/path evidence, relativity, exact program version and TS strategy remain incomplete.", "No formal replacement candidate, real M1 source or real M1 sidecar exists."]
    },
    {
      "phase": "P1",
      "status": "blocked_incomplete_electron_spin_wavefunction_coordination_method_ts_m1",
      "implemented": true,
      "evidence_complete": false,
      "executable": false,
      "evidence": [
        {"kind": "contract", "locator": "contracts/asymmetric-catalysis/metal-p0-p1-baseline.schema.json", "sha256": "05c6531f534a03f2c58b6497f14385edc77bdd554fb9f8eaab21cb0b1b9b91e2"},
        {"kind": "contract", "locator": "contracts/metal-ts/r33-p1-evidence-ledger.schema.json", "sha256": "bf217849ec7bf4c989066789b44b619d93c9f22a5b0bbf96bc494e12b167bbd4"},
        {"kind": "contract", "locator": "contracts/metal-ts/r33-m1-blocked-review.schema.json", "sha256": "4a72cf941da87986fbf4359af042b40c48c4ec3c8faf0ee1d172e1e2f6638781"},
        {"kind": "artifact", "locator": "studies/metal_m4_p0_p1_baseline/r33-candidate-inventory.json", "sha256": "e810d3e8a17950345b0e71b2b3a7671ecc7136c693f8d803ac87069856542497"},
        {"kind": "artifact", "locator": "studies/metal_m4_p0_p1_baseline/r33-p1-evidence-ledger.json", "sha256": "04dfa06a1b882401176982af8fb0d2aeb4c526a01b0ee16f8dbcd4ae0e81b38b"},
        {"kind": "artifact", "locator": "studies/metal_m4_p0_p1_baseline/r33-m1-blocked-review.json", "sha256": "bae51315c9fc5d4578c87d6ec044e6bb5f7beef532939327c7f1dc5d72a6f2d0"}
      ],
      "blockers": ["The primary article reports multiplicity 1 and closed-shell context for the investigated set, but that does not close alternative spin-surface or single-reference suitability review.", "Oxidation/electron accounting, wavefunction policy, coordination, method, TS/path design, and a real builder-compatible M1 chain remain incomplete."]
    },
    {
      "phase": "P2",
      "status": "engineering_contract_implemented_activation_blocked_by_p1",
      "implemented": true,
      "evidence_complete": false,
      "executable": false,
      "evidence": [{"kind": "commit", "locator": "890dbef87369f53d6c3808df4f4c3943ebd612fd", "sha256": null}, {"kind": "contract", "locator": "contracts/metal-ts/input-approval.schema.json", "sha256": "08387029022377f19d279b08b048fac06191af98a366ac59e69ed9aaaf98dafd"}],
      "blockers": ["Real-case activation is blocked by the incomplete P1 candidate evidence chain."]
    },
    {
      "phase": "P3",
      "status": "engineering_contract_implemented_activation_blocked_by_p1",
      "implemented": true,
      "evidence_complete": false,
      "executable": false,
      "evidence": [{"kind": "commit", "locator": "18545cbee46370b12c080489a4a0c1e25772ded7", "sha256": null}, {"kind": "contract", "locator": "contracts/metal-ts/result-acceptance.schema.json", "sha256": "56e6bded409bc7cbae91e47bcdde6d21a808d5ee9d30bffad8f6dd32239cb721"}],
      "blockers": ["Real-case activation is blocked by P1 and therefore has no candidate-bound result evidence."]
    },
    {
      "phase": "P4",
      "status": "engineering_contract_implemented_activation_blocked_by_p1",
      "implemented": true,
      "evidence_complete": false,
      "executable": false,
      "evidence": [{"kind": "test", "locator": "tests/test_metal_ts_runtime_contract.py", "sha256": "6730d387a89e386a0f2c074ffa4f6b5b27e8f4ffe1d4492cb6237898ab694216"}, {"kind": "contract", "locator": "contracts/metal-ts/promotion-decision.schema.json", "sha256": "dd62e4a08f04079e1b6f697910eacd610da28add1777c83e3bae6d86584bed1a"}],
      "blockers": ["Real-case promotion review cannot activate until P1 and all upstream candidate-bound gates pass."]
    },
    {
      "phase": "P5",
      "status": "approval_package_assembled_planned_not_submitted_blocked",
      "implemented": true,
      "evidence_complete": false,
      "executable": false,
      "evidence": [
        {"kind": "contract", "locator": "contracts/metal-ts/p5-approval-package.schema.json", "sha256": "cbae7384074bef6a8337cd93ea26dfdfc1abb86a081531a91cc8544345a7e824"},
        {"kind": "artifact", "locator": "studies/metal_m4_p0_p1_baseline/r33-p5-approval-package.json", "sha256": "4cad30427be6297b2c2ba8553b6aafc17fd9af731390fb95d833a918dbe01add"}
      ],
      "blockers": ["The package is planned_not_submitted and blocked by incomplete P1 plus absent real P2-P4 candidate evidence and metal execution-boundary approval.", "Protocol options/selection, input draft/hash, resources, fresh server directory, and exact live authorization are absent.", "No SSH, PBS, Gaussian, retry, IRC, cancellation, cleanup, deployment, or live smoke was authorized or executed."]
    }
  ],
  "readiness_payload_sha256": "d193a77a11397ccc1e8b599f500ded34fc01d356b7c3e496b8738c5f38917124"
}
